Review Number,Review Text,Store
209,Always have big queues.,Lidl
210,Very good the prices.,Lidl
211,Who doesn't love a good Lidl,Lidl
212,Good for weekly shopping !,Lidl
213,Busy store. Get in early!,Lidl
214,Great for quick visits.,Lidl
215,Great Lidl. Super friendly.,Lidl
216,A bit smaller then most lidl stores,Lidl
217,Good place,Lidl
218,"Meat, fruit, vegetables and special offers are tops in Dublin",Lidl
219,not very nice staff,Lidl
220,"Grand lidl, staff arent great though",Lidl
221,Bakery department is great....,Lidl
222,Always great staff,Lidl
223,It's a grocery. It's fine.,Lidl
224,Good produce and prices,Lidl
225,Could have more choice,Lidl
226,Very good value,Lidl
227,Unbeatable prices!,Lidl
228,The lady in cash was so rude,Lidl
229,50 cent jellies 1 euro coffee,Lidl
230,Good staff,Lidl
231,usual Lidl never enough staff working,Lidl
232,Not much variety of products,Lidl
233,"nice people, quick, etc.",Lidl
234,Friendly helpfull staff,Lidl
235,Usually handy to park,Lidl
236,really nice employee,Lidl
237,Service very good,Lidl
238,Big and with different products.,Lidl
239,Very helpful staff,Lidl
240,Okay shop with okay prices.,Lidl
241,The best price of Dublin!,Lidl
242,Not good no star,Lidl
243,Very slow moving queue,Lidl
244,Very good alternative in  Dublin,Lidl
245,A beautiful area to live in,Lidl
246,Only one till was open ..,Lidl
247,Great prices!,Lidl
248,Good shop,Lidl
249,Good prices!,Lidl
250,Very good prices!,Lidl
251,Cheap bakery here.,Lidl
252,'New' layout is terrible,Lidl
253,Great value.,Lidl
254,staff are extremely rude,Lidl
255,All I need is you.,Lidl
256,Staff could be friendlier,Lidl
257,Well priced supermarket,Lidl
258,Nice experience,Lidl
259,Was very interesting.,Lidl
260,"Well, one more Lidl.",Lidl
261,OK shop.,Lidl
262,Is too cooold inside,Lidl
263,Always huge queue!,Lidl
264,Great prices,Lidl
265,Good value,Lidl
266,Ecerything I needed and cheap,Lidl
267,Excellent  I  was looking for,Lidl
268,loads of vegan options,Lidl
269,Great supermarket!,Lidl
270,Nice and cheap,Lidl
271,"Lidl is Lidl, always good.",Lidl
272,It's lidl... It's good,Lidl
273,Great shop,Lidl
274,Great place,Lidl
275,Lovely place,Lidl
276,Almost like in Germanz,Lidl
277,Great staff,Lidl
278,Great bakery,Lidl
279,Good location,Lidl
280,It is just a supermarket.,Lidl
281,Excellent,Lidl
282,Convenient. Location,Lidl
283,More 4 you,Lidl
284,It is a normal store,Lidl
285,Brilliant supermarket,Lidl
286,Best store,Lidl
287,Lidl is always cheap,Lidl
288,Dublin 2,Lidl
289,awful staff,Lidl
290,Great option!!!,Lidl
291,Good shop,Lidl
292,Cheap food,Lidl
293,Well located,Lidl
294,Super class,Lidl
295,Good,Lidl
296,Great,Lidl
297,awesome,Lidl
298,Lidl I'd lidl is lidl :),Lidl
299,Best Supermarket,Lidl
300,Great prices,Lidl
301,Good supermarket,Lidl
302,Good value,Lidl
303,Food,Lidl
304,christmas shopping,Lidl
305,It's a lidl,Lidl
306,as expected,Lidl
307,Lidl is lidl,Lidl
308,Lidl with bakery,Lidl
309,Excellent,Lidl
310,Cheap,Lidl
311,Great,Lidl
312,Good,Lidl
313,Good value,Lidl
314,it is lidl,Lidl
315,Prices are affordable. Product variety is sufficient. It can be preferred for economical shopping.,Lidl
316,"Great takeaway coffee, cheap, quick and convenient",Lidl
317,"Even in Ireland, Lidl is the benchmark supermarket for value for money, even for wines. (Rare and expensive goods in Dublin). On the other hand, you will not always find everything you need.",Lidl
318,Approx. Lidl.,Lidl
319,"Lidl is one of the cheapest supermarkets in Dublin. You can find most of your daily food and drink needs in a large supermarket. Occasionally, cheap products with promotions also come. Available everywhere in Dublin. You can find alcohol types, fruit juices, all kinds of meat, cheese, bread types, fruits and vegetables, and sometimes shoes to wear.",Lidl
320,Very unpleasant staff. Will not issue checks upon request. Little conflict,Lidl
321,It is a good place to shop and has good prices but there is always a lack of replacement. Many times there is not the product I want.,Lidl
322,Very good prices and good product quality. You can also find everything from eggs to pens.,Lidl
323,"Very good shop, easy to access, essential product to carry at hand",Lidl
324,"Nothing special, ordinary Lidl. Prices are a lot higher than in the Netherlands and Germany.",Lidl
325,"Classic Lidl, well structured, good food, very good products",Lidl
326,"Disliked - not enough space, tight spaces and they always don't have my favorite ice cream here",Lidl
327,fantastic Good service and a very wide schedule!,Lidl
328,Everything very organized and clean,Lidl
329,"Affordable prices, quick checkout",Lidl
330,Quality products at a low price. Greater Ireland,Lidl
331,Very good shop,Lidl
332,Very good place to buy,Lidl
333,You get everything you need at affordable prices.,Lidl
334,I went during Italian week and wow,Lidl
335,Perfect for running quick errands.,Lidl
336,This market is quite diverse,Lidl
337,Cheap and includes everything you need for food,Lidl
338,Cheap AF.,Lidl
339,Variety cost and quality.,Lidl
340,Good prices,Lidl
341,Excellent shop,Lidl
342,*--*,Lidl
343,good prices,Lidl
344,excellent,Lidl
345,They have crab sticks 😍😍😍😍 …,Lidl
346,It's flour,Lidl
347,Nice Lidl,Lidl
348,Lots of products,Lidl
349,Dirt,Lidl
350,nice personel,Lidl
351,Excellent,Lidl
1,"Terrible Lidl. No baskets at its right place, we need to pick them up close to the cashier (if they have any!). Lights regularly turned off around the bakery area. Narrow alleys. Very long queues (2 or 3 cashiers working at most). Inefficient security people. Plastic recycling machines very often out of service. dirty floor. Constant lack of supply in the food area. Often out of plastic at the veg area, and the list goes on...

Taking for example Lidl Smithfield, it's day and night with Lidl on Thomas St.",Lidl
2,"Always so clean & fresh , brilliant staff on checkouts, great hospitality service by all the team. 🌟 🌟 🌟 🌟 🌟 …",Lidl
3,"Very poorly managed Lidl, messy, poor quality (not fresh!) vegetables, the Return scheme machines constantly out of order!",Lidl
4,"Today I went int Lidl Thomas Street, rooster baby potatoes, 39c, also rooster Irish potatoes, in each box, the charge on these is €1.79. price not displayed,got to the register, pointed this out, they where mixed in, assistant got a manager, then another aggressive manager, came, pointing out, few bags got put there, nope, each bix had at least, 8 bags of €1.79, irish roosters, in them, customer service is the worst i ever encountered, check your receipts , before you, leave lidl,",Lidl
5,"Beautiful place. Has good products, good price and is clean and tidy.",Lidl
6,Prices higher than in othere lidl shops…. I just paid water more than double of price in my local lidl… 29 cent water there and in this shop 70 cent…. Othere items are also diferent prices… 👎🏻 …,Lidl
7,No caviar And smashed Glass Saw Bad people fighting in Lidl I’m Staying In Dublin7 Lidl for now,Lidl
8,"Horrible service, no staff on the floor and they not not have time for customer inquiry.",Lidl
9,"I live beside Lidl Thomas Street.
So no 1 star should be giving. Almost everything in Lidl PRICE is STATED WRONG. This in on loads of the products.  This should not be allowed. And the bread/ cakes  is not covered from flies and dust.
I do not even find staff helpful.
Nothing I like about this shop.
And never enough tills open.",Lidl
10,"One star because there is no option to give no stars. The green haired woman who works as sales person was as impolite as one could be. Then we wanted to pay and she asked if I was 25 because its legally not possible to sell alcohol to a under 25 year old, which is nonsense. And even if it was like this, she was just too rude, to everyone. Not going there ever again.",Lidl
11,"Manager of the premises...This message I'm addressing to you guys. PLEASE!!! Remove the cashier, (Irish woman with green long hair, wear glasses), from the till. She is disgrace of this shop! So rude and mean to customers ! Or give her proper training how to deal with customers...",Lidl
12,"Great shop filled with everything you would need for the families weekly shop or if you just want to pop in and get just a couple of things like 3ltr of milk only €2, the price's are amazing and can't be beaten especially in this particular area, their cheaper than Tesco Spar Centra etc and if you download the app you can get some get things at 50%-75% off or just completely FREE, great shop and very helpful staff..",Lidl
13,"Lately,  not so many products.
Disappointed that I  don't find what I need anymore",Lidl
14,"I was curious what would look like the ""new"" Lidl"" after relocating next door. Well, that's the 2020 version. Well organized, though you find the classical Lidl pattern. Good lighting, higher standard refrigeration equipment, improved client orientation. Clean! Even the tills are 2020. I saw the first Lidl in the 90s on the Italian Riviera. To Thomas street it was like a market stand to Brown Thomas! And the bus stop is right in front of the door. You can leave your Bentley home and Lidl shop by bus! 13, 40, 123.
Only disappointment: no baskets on wheels anymore. The handheld ones are too small, the caddies too big...",Lidl
15,"Refurbished store is easy to navigate, wide aisles and can reach all shelves as a short person.

There can be some great finds in the orange sticker discount range.

Great value for money, especially for bags of dried fruit and nuts. I'm always amazed at how little I spend here for the amount of groceries that I bring home!

Always plenty of fresh food in stock!

Staff are efficient and friendly, extra tills open if queues are building.

Thanks Lidl, keep up the stellar work.",Lidl
16,"Good choice and section of fruit, vegetables and other groceries. Constant deals on especially the greens. I have found some fruit on special to be bad so make sure you get stock from underneath trays. Very quick staff on counters but sometimes you do run into the case of not enough lanes being open. Have returned goods before without any complication.",Lidl
17,Great place to buy,Lidl
18,"Very clean, full range of products, fruit and veg, bread, fish, cleaning products, frozen foods, daily freshly baked breads & pastries. Has a specialty section with some gourmet cheeses and desserts. Also does wines and full range of spirits.",Lidl
19,"Lots of customers, children and a couple of dog's too in store today.  Made the store seem busy and untidy and staff unpleasant.",Lidl
20,You can be ashamed of what you sell to people. Third time in last couple of months that I haven't got crunchy bread in my ceasar salad. Not to mention state of the salad. You have completely changed sauce inside as well. And on top of everything you have been raising prices quietly . Not the cheapest for sure!,Lidl
21,Really good quality spotless clean love the bread when entering store always pick up a loaf or 2 great that the machine is there to slice my loaf of bread to the thickness I prefer also using a lot of store brands are much cheaper and not much of a difference could be more staff at hand on tills as cues get really long at times but other wise I shop here on a daily basis and will keep on doing so keep up the good work Lidl 🌞,Lidl
22,I was at this supermarket to work. Withdraw all the food from the shelves as they would pack the shelves. The way they do that is awful. They want speed and less care. The treatment sucks. I do not buy any more in this place. They should hire people who are careful about what others are going to buy to eat. We are not pigs.,Lidl
23,"Good shop generally as Lidl usual with good bakery. Nice and tidy except the non-food section is messy. Also not much non food items for sale, only 2 small isles..small but good Lidl.",Lidl
24,"I do my weekly shopping from this branch. Very friendly staff, quick service even in long queues. My favourite place for vegetables and fruits. Not only reasonably priced but very fresh too. Organic milk and eggs are must try items. I think the best free range eggs you can get I am not too sure about milk and its local.",Lidl
25,"a very strong point of this place is the availability of schedules. is always open in long periods of time. always with good products and a very tasty confectionery with fresh products. the service is always very good and surely this place is suitable for anyone who is looking for products for home, cleaning, cooking, items for the home.",Lidl
26,Crowded. No self-checkout tills. The flor is dirty. The baskets have fruit and vegetables left inside. So definitely not sanitized and or looked after. No social distancing observed what so ever. The only bright side are the people working there who are giving it all they have to work in these conditions. Avoid if possible.,Lidl
27,It's been good since they have redone the store. Everything is always well stocked up. The specials section is still not like the bigger stores. That's probably the only negative point.,Lidl
28,This store is the worst lidl I have ever been in. It is totally disorganized. The staff are friendly  but overworked. The produce is substandard I am using it because Cork St is closed  just now. Cork St was a joy to shop in it was very well managed and the staff were brilliant.  I can't wait for it to reopen.,Lidl
29,Great shop! But please... Please.. fix those baskets with squeaky wheels !! Its like a torture to shop in there with all that loud squeaky noise.,Lidl
30,Good product selection and the best Lidl staff in all of Ireland :) No self checkout :(,Lidl
31,"It's a Lidl, what else do you need to know?
This Lidl is a smaller one than other stores so it doesn't have the same selection of goods. It has most of what you'll need though for a quick stop on the way home from work.
Their alcohol section is quite reduced though, and they have a lot less of the ""random""/seasonal items that the bigger Lidl stores have. Still, for what it is, it is fine and is handy to have in the area.",Lidl
32,"The store manager Akil was shockingly rude on the till. He kept his headset on and was talking to staff somewhere else in the store. The lady ahead of me asked three times for a bag and he eventually threw one at her. No please, no thank you.
He didn't even make eye contact with anyone. Then he yawned as wide as the liffey and proceeded to serve me. Again no acknowledgement at all. He was so rude that I made sure to say ""Thank you Akil"" to his face nicely and clearly...he just ignored me.
If he is managing then the staff have no hope.",Lidl
33,"Great place not too many queues. Self service tills, in my opinion are great, its less of a rush. Love Lidl in Moore street has lots of them. Thanks",Lidl
34,Terrible store to shop in....I like lidl  as a whole regarding larger stores but Thomas Street branch is just not for the customer especially family's as you have to pass through the array of drunks sitting at the front door which can be very intimidating. ... products are constantly placed under the wrong price point ...the Isles are very narrow & constantly full of pallet trucks packing out stock which I understand that is necessary but not prime time when the store is so busy also not a great selection of stock regarding what would be advertised in the weekly flyer...,Lidl
35,Clean well stocked good specials ..a god send if I'm honest. Fresh food from around the world...its a far cry from the bananas and oranges which sat atop prams when I was a kid. So many healthy options for people without having to travel far or pay exotic prices. Lidle is amazing for Ireland in general I also found almost tevery diy tool I need here as well. At bargain prices. Drill bits and corner clamps and stain for the shed and Protecting gel.. Can get my whole shed fixed now! Love it!,Lidl
36,"Lidl is currently operating in what I assume is a temporary capacity in Thomas St, as the original shop undergoes a revamp.
So the situation is far from pleasing to the Lidl customer. Today the shop was like a fridge , and not just around the expected cold areas.
Also the smell of burning rubber from the adjacent new premises was nauseating.
Add the amount of dust built up from the work and you get the picture.
I can't blame the staff, as they have an impossible job and they have my sympathy.
But Lidl should have thought of these problems before they undertook their reconstructions
Since the renovations have been completed,  Lidl has become a good and organised supermarket.
The staff are friendly and helpful and the products on sale are good and reasonably priced. Lately, like a lot of supermarkets,  they have suffered from lack of supplies but thar is entirely understandable.",Lidl
37,I like this place. It's my favourite place to making shopping. Cheap products and great quality. Is only one problem. Car park. No one in front of the shop and in the back very early closing,Lidl
38,"Good store, very handy as it's right on the bus stop (Bridgefoot Street) on Thomas Street. A bit smaller than the one on Moore Street but well stocked and also less busy. Has fresh bread! 🙂 …",Lidl
39,"It is a cheaper grocery store that has good products and a reasonably wide range of products.
It's open 7 days a week and has good promotions from time to time.
Opening hours are 8-22 each day apart from Sunday when the shop closes at 18.
It's similar to Aldi but with a little wider range of products that Aldi in Parnell Street.",Lidl
40,"As all Lidl, great shop with a large selection of great products with cheap prices but good quality. Always found a good deal. A lot of bakery products fresh and still warm with so nice smell of bread when you go in :)",Lidl
41,"Unbeatable prices.
Well stocked outlet.
Perfectly satisfactory shop every time, never disappoints.
Excellent staff.
Brilliant customer service.
Dazzling, clean store.",Lidl
42,"If you want to wait very long between drunken people, one of the worst....very sad!",Lidl
43,"Great for the essentials not so much if you're looking for the specials.
Bright.  Clean and friendly as you'd expect.",Lidl
44,It's a fine convenience grocery with a nice baked goods area just inside the front entryway.,Lidl
45,"What can I say! Sliced pan and 16 jumbo sausages €3.73. Try beat that, absolutely great value for money.",Lidl
46,"Good selection of groceries, probably the best supermarket in the area. It does however suffer from a lack of space and therefore the three checkout lines usually have huge queue which in turns makes it difficult to browse some of the aisles.",Lidl
47,Good shop but I shop late and I find shelves getting empty and no one replace stock,Lidl
48,I always able to find some veggies and fruits package free. It would be great to see bigger variaty of loose products. Also a good place to buy bread withou additional unnecessary plastic!,Lidl
49,Good quality food at low prices however the new layout is awkward and at bust times it can be quite hard to navigate the Isles while I love lidl in general the Thomas Street is badly layed out and planned even after the renovations were carried out and there's still no access to the car park via the shop itself that said the staff are very helpful and friendly and the manager knows the layout and lack of access is an issue,Lidl
50,"One of the biggest lidil in Dublin city. The stock is really good and there is dedicated sections for most of the things. Also they have cheap coffee machine in the entrance. The bakery section is also pretty huge and they have a lot of different items there.

More tills makes less queues and thats the thing here.",Lidl
51,CONGRATS TO ALL THE MANAGERMENT AND TEAM ON A WONDERFUL JOB. HIGH FIVE AND FIVE GOLDEN STARS TO ALL THE MANAGERMENT AND TEAM FOR KEEPING THE SHOPPING COST DOWN FOR ALL YOU'RE CUSTOMERS. I LOVE THAT. 100% WONDERFUL JOB. YE THINKING OF ALL YOU'RE CUSTOMERS 1ST THAT'S WHY YOU'RE SHOP IS TOP OF THE CLASS. CONGRATS AGAIN.,Lidl
52,"Always a pleasure :* Love smashing that green happy face on the way out. The staff are like family... who i dont speak to and whose names i don't know. XXL is the specialty range on at the moment. Not my favourite by a stretch but just dont have the heart to drop a star from the rating. Got the brazilian lad on the checkout today. Pretty sure my gf fancies him. But anyway, Well deserved lads. Keep on serving the community",Lidl
53,"Even thought not a big shop, they still have almost every item that they sell at the Lidl shop at Moore Street. The main advantage is that this shop is not so crowded and hence you still get all the fruits and vegetables even if you are a little late to go to shop in the weekends.",Lidl
54,In general i like lidls brand alot. But this one needs some renovations to be done. I understand that this one is in one most expensive citys centre of the all world and that particular store is in old building so is very squeezed. Is not alot of space inside is quite busy and staff is professional nice for the customers but usually is just not enough of them. More just sometimes fresh bakery is just not there or long queues at the till. While two people at the tills working hard there is nobody there to help them.,Lidl
55,"The redhair woman cashier was very  unprofessional and inopportune i don't know how some people can work.
She mocked my cousin with down syndrome with her colleague. Unacceptable.",Lidl
56,"The queueing time in this branch is almost always horribly long but staff members are very kind and helpful! Also, due to the size of this store, neither the selection is as huge as that in most of other Lidl stores in Dublin available. For example in their Cork Street branch which is about 700m away.",Lidl
57,"Head here some lunch times, queue's are ridiculous most days. Aisles are small so it can get cramped around the tills. Smaller than a lot of Lidl's but has a decent enough selection of goods.",Lidl
58,Good local store to do your shopping but unfortunately recently I've noticed a lot of products in the magazine are not available which can be disappointing,Lidl
59,"As with all Lidl stores there is a good selection of products which are well-priced with each area clearly marked. Staff are well-trained, pleasant and helpful so even when the store is busy there is usually not much delay in being served",Lidl
60,19 people waiting in the line for one open cashier. This I call a weird way of serving. Never ever aigain I will visit this place.,Lidl
61,"Always affordable prices, quick staff even in busy times. Buying there for 8 years now. The deals of the day are fantastic.",Lidl
62,"Some product where just in the open with no rules of hygienic, people got no mental value of stuff, some workers where rude. I even got sick from eating once from there bakery choices. Lidl in Belgium are alot better then here.",Lidl
63,"Early in the morning best timing for the shop,  after it is a bit messy. Staff always cordial and ready to help.  Queue at the till generally fast.",Lidl
64,I went earlier and I disabled so I got everything I needed and a good price some pricing hard to follow if bub,Lidl
65,"Worst supermarket you can experience. Rough staff. Dirty, unorganised... Back to the roots. Still being an incredible dirty place! I only can think that management here is not doing the job.",Lidl
66,"Lidl Thomas Street is great since the big refurb - clean and well lit, nice bread and good stocks of everything else you'd expect - and the staff are friendly! Highly recommended.",Lidl
67,"Nice shop close to the city center. Discount prices, limit selection (though it has all the basics) and good quality. Fast checkout.",Lidl
68,"It's newly refurbished, more space, great bakery. I would go there anyway for the prices. It's certainly a bit busier after the builders left.",Lidl
69,Had some empty shelves but I was able to buy everything I needed. Also it wasn't too busy which is great!,Lidl
70,"Unprepared,and rude staff.
They don't follow their own rules and are not prepare to explain them to customers either.",Lidl
71,First time here since the refurbishment - nice to see it but noticed there are no self service checkouts.,Lidl
72,"This particular Lidl on Thomas street Dublin is a joke. Very badly stocked, pallets of unpacked goods and empty boxed strewn all over the floor. And the worst is that there was one till open with a queue of over 10 people and a cashier that scanned the shopping so slowly and then can't make eye contact with you when you speak
Very poor. Worst Lidl ever",Lidl
73,"Visited 27th December early around 9:15am, it was lovely and quiet with good amount of stock and fresh fruit and vegetables",Lidl
74,Good place to shop but only on your own. It is a very small branch and most of the time busy with a long queue at the cashier,Lidl
75,"Very helpful workers, I wish I could buy Goody Cao here, just like in the Lidl from Poland and Italy.",Lidl
76,Don't expect great service but it has a good stock of good at competitive prices.. good for bulk purchases for monthly groceries,Lidl
77,Nice. Staff is nice and apart from usual cheap corner  cutting things it has a lot of good stuff too,Lidl
78,"Love going here, lots of choice great value for money and very nice staff always smiling 👌👌👌 …",Lidl
79,Decent selection of foods on sale here. Can get busy. Sorry.,Lidl
80,"It's a small lidl, doesn't have everything you normally find in LIDL like electronics or clothes. Mostly food. Queues for checkouts are usually packed and wait is long any time of day.",Lidl
81,It's still a great Lidl but it's shocking how the veg is understocked compared to other Lidls in Dublin.,Lidl
82,A little on the cramped side if I'm honest. Often times there is a conciderable wait for a casheer. That said I like LIDL's food so go there regularly.,Lidl
83,The only reason why I am not giving it a 5 star is because it does not have chilled drinks. You need to buy then in advance and chill them at home.,Lidl
