Review Number,Review Text,Store
4,"Its the price labels, really really all over the place or not there at all. There is no Lidl Ballymun store branch phone number.

I asked a girl for a price on Cien deodorant, as it also had Africa and some other Lynx scent on the SAME label for €0.89 (EDIT : Getting better, maybe they are reading but not actually acknowledging in here).

I asked one of the floor assistants to help with THEIR problem, not my problem, and was told to queue up to verify, no way, and asked her to do it, as this was ridiculous, she snatched the Lynx out of my hand stormed to the till  saying ""I'll do it then, happy"" came back, Lynx was €2.50 something, not even acknowledging THEIR complete fault for a customer query and just stormed off, completely unacceptable.

Whether this was deliberate to embarrass people at the tills and buy Lynx, like the old

(Bait and Switch its called in fraud and deceptive practices circles)

I dunno, but the pricing was totally and utterly wrong or make no sense, Rolls for €0.50 cents each or 4 rolls for €2.00... Ehhh yeah 4 x €0.50 is €2.00 ??? and they aren't sold loose so whats the point of that, in the pies meats cheese wrong labels, wrong places, weights wrong or over the wrong product,

I might get pictures next time I'm over there tomorrow 08 February

BTW, Lidl Drumcondra does not have all these issues  just the rolls, only Ballymun, so its Management and the shelf stackers not taking care that's the issue here IMO, as for mam in her 90's going here, forget it, when she goes here, there were nearly always 2 or 3 things she didnt get because there was the above mentioned issue with pricing labels, or an overcharge but thats usually balanced with an under charge as the prices are SO wrong, kind of ironic and moronic at the same time)",Lidl
5,"Not honouring closing hours. The ""opening hours"" sign says opened until 9pm. However, at 8:50pm they stop letting people in. Would you please change the sign to 8:50pm then?",Lidl
6,"The store is really nice, but I would prefer if the price tags were in the right place, that's it.",Lidl
7,Great store to nip in and out. But when they have plants they have great prices and quality...,Lidl
8,"Since recently they have really great, helpful and very friendly staff. They changed a lot regarding customer service. Lidl in Drumcondra Road has become our  favourite shop since then.",Lidl
9,"Mess of a store. So many empty shelves all the time, long queues, disinterested staff, out of date products, etc. If driving, better off going around to Glasnevin Lidl",Lidl
10,"I ventured into the Lidl supermarket, a land of budget-friendly delights, and my journey was a joyous one indeed. The store was clean, and the staff dazzled with their ever-present smiles. However, my trusty shopping cart had a rebellious streak, with a wobbly wheel causing chaos and mischief. So, dear Lidl, might I suggest a valiant quest to replace or swap these renegade carts, making our shopping experience a true 5-star escapade?",Lidl
11,Great store.  Good discounts,Lidl
12,"Parking is almost not available at any time.
Not the first time I've bought somthing and get home to see its over 4 months out of date.

Stock checking of items is terrible.
Be Aware of dates when shopping.",Lidl
13,"Best supermarket in the area!
Clean.
Well stocked. They didn’t had the stuff from the advertisement this was quit annoying
Cheap.
The bakery is really nice
But coffee machine every time broken and the elevator was also not working this is really annoying",Lidl
14,"It was very worth it going to because of two things:
1st It is close to my apartment (around 1km lol 😂) and shopping for a good value👍the only thing is that I was a lil bit lost actually in where could I find what I needed because of the way how they organize and separate the groceries in there. …",Lidl
15,"NEVER EVER SHOP AT LIDL DRUMCONDRA if you have to go with a car. The parking is tiny and is full 9 times out of 10 ! Today I had to pop in very quickly just for bread and there was only the 2 disable spaces available. I reconned that since I was going to be so fast, if I park in one, what are the odds that in 10 minutes they will be both needed... Well, I wasn't even 7 minutes in and I was clamped straight away. The clamping car was actually still there and had to wait for 20 minutes, while I manage to get somebody on the phone at his company to pay the €120 euros fine.
The most expensive bread ever!",Lidl
16,"No bags. Barely any staff on the floor to help you. Massive lines at the till every single time you go in. Always only two cashiers on the tills regardless of how many people are in the shop. Lines literally going from the tills half way down the aisles. Deplorable. Never seen a Lidl like it. Go to the small corner shop across the road, you'd honestly be better off!",Lidl
17,"Slightly smaller that other Lidl shops. You may have a little less variety than in other branches.
Bike parking is located inside the car park not in the street and it is limited to 3 racks. A good bunch of car parking spaces although you may need to wait at peak times (only happened to me once). Clamping actively in operation so don't risk parking on the wrong spot",Lidl
18,So disappointed with this store.  Did my shopping there last week and when I came back to my car I was clamped.  Went back into the store and was told nothing to do with them.  I walked out the main car park entrance to watch my child cross the road to an appointment and walked back in to do my shopping but seemingly you are not allowed walk out that way so I was clamped.  Had to pay €120 extra to release my car after my 25 min shopping trip.  Clamping Co refused my appeal as they say they are a poor private company so my fault as I used the main exit.  Be careful guys!,Lidl
19,"Amazing day in Tayto Park. So much to see and do! Super staff and lots of thrills. Nissan 'driving liscense' was only disappointment, b long queue in a stuffy corridor followed by a 3 min go on the cars and an extra fee to get a printed 'liscense'. Everything else super.",Lidl
20,It's lidel lads your not gonna get the best of anything really lol service  is the biggest  thing for me and bar maybe 1 or 2 staff all the rest don't want to be there abd they just fling the food at ya good job I played gaa to catch it,Lidl
21,Well laid out airy store. Great selection of fruit/veg on offer. Great views from window on first floor looking towards Wicklow mountains would make lovely cafe. Please introduce fast checkout lane max 5 items. It is tiresome getting caught behind customers with big weekly shop.,Lidl
22,"Guy in the till today at 19:30 u deserve a raise! Never saw someone as efficient in a  busy supermarket hour, operating two lines at same time with kidness and precision, incredible!",Lidl
23,"Bought a NON STICK FRYING PAN  , no more non stick frist bit of meat put on it stuck to it like Glue , brought it back told get on to customer service and get A number ,was told they would mail me a voucher / returns docket to bring back still waiting for it over 2 months now , still carrying the Pan in the boot of the car , was last out @10  girl on check out was in a hurry scanned in 3 litre of full fat milk , ran the scanner over it again for / As  a 2 ltr. Light milk , only copped on when i looked at receipt at home  not nice & not for the 50 cent in the difference never went back to shop there",Lidl
24,Really like this Lidl store. Staff are all very helpful and friendly led by the manager Max. Very clean too. Only minus would be a pity that they didn’t include self service tills like East Wall as it can get very busy sometimes.,Lidl
25,"This Lidl has a weird layout, but there is planning permission that says they're going to change the internal layout a bit. So as of October 2020 the layout is weird, but they're working on it.

The vending machine is nice and the prices are great.

If you don't want to use the escalator, there is a staircase around the corner of it.

Go early in the morning if you want the cheaper food because the students who live in the area tend to buy it all up by lunch time.",Lidl
26,"Elisa is just super helpful.
kudos for going an extra mile for me this morning.
extremely patient when I had trouble paying with my revolut.
Thanks so very much again Elisa.",Lidl
27,"After 45 minutes waiting on car parking, in smelly of petrol , see the security guy live the people to go in on his discretion finely comes m turn to go in an I asking security how is possible hi start to teaching m how I need to have patience, a guy with no visible license no tag nothing else end hi telling m if I don’t listen to him hi can stop m to go in. Nice staff ho barely can read make a teacher on costumers how supposed to take all how they wanted and shut up or u don’t go in.",Lidl
28,Bycycle area used as a toilet about three weeks ago and not cleaned yet.human waste on walls and bycycle security pillars...bad standards,Lidl
29,"The car park is really small and tight if don't drive a toy car. The store looked a bit desheveled, quite a few spaces where the things I wanted used to be, similar issue in a few stores recently like Ballymun, finglas & gullivers 🙄 …",Lidl
30,"Visited Lidl Drumcondra on their opening day, Feb 20, 2020. As you would expect, the shop was spotless. Nicely laid out and lit with the usual range of Lidl stock. The car park is very small and exciting onto the very busy Drumcondra Road will be difficult at times.",Lidl
31,"This is the best Lidl store ever, well stocked with all my favourites, Steaks, Cheeses, fresh vegetables, great range of beers and wines. Very Spacious, and well organized with hand Sanitizers and Tissues, and of course very polite staff. See you there in the wine section.",Lidl
32,"My partner 71 years old just went to your store.
There was no special time range for old people - normally up to 11 - no social distancing at the door. One security guy doing nothing!! So it was packed inside.
What's going on there?
We are expecting an answer. Thanks.",Lidl
33,"Overall a good store.
I just wish the first floor door to get to the elevator and back to it would stay open at all times.
It’s extremely hard to open the door if you are alone with a buggy!",Lidl
34,"10am on a Sunday, very quite and easy to shop.  Everything I wanted in stock.  Go full Lidl",Lidl
35,Called in this evening at about 2055 not realising that it closed at 2100 until one of the rudest so called security men I have ever encountered started waving his hands saying hurry up hurry we are closing. An elderly man came in after me and he treated him with the same disrespect. A comedy of errors trying to get out into the carpark as the doors to get out were locked. I'll stick with Tesco and by the way this store has made a dreadful traffic situation much much worse. I must say though the people on the tills were lovely.,Lidl
36,"Just home from store now  was very annoyed.to see no paper towels on way in and nobody supervising Q's... guys in particular are not keeping distances and not giving other customers enough space to proceed.     Im very nervous now and no sure if I would feel save going into the store now.  I live locally and visit store 3/4 times weekly
Mary Cashin",Lidl
37,"Very good store, sometimes a bit disorganised. The fresh pressed orange juice machine is an plus, but need more attentio, as it is always a  mess. Great deals,  and good value for money.  Excellent location!",Lidl
38,"Love it. Just wish they had more Gluten Free options, such as pizzas, bagels, muffins, etc.",Lidl
39,"A great Lidl in the heart of Drumcondra (on the Drumcondra Rd Upr opposite the Ivy HSE Pub).. They have a small enclosed car park, with the entrance to the left of the shop. Might be tricky to get parking at certain times.. Otherwise a great shop with everything you'd expect from Lidl. 👍🏻👍🏻 …",Lidl
40,"Fantastic new Lidl shop. Big selection of foodstuff, usual great quality and prices. Lots of space in store so easy to physically distance, very important during COVID.",Lidl
41,Excellent shop well stocked never long at tills ahead parking is convenient,Lidl
42,"I just love it!
Super wide range of products.
Very fresh vegetables, meats.
Super taste sweets!
Cute staff!",Lidl
43,A mediocre experince at best. A noted absence of common kitchen utensils such as spoons. How can a man eat the food on offer without a the correct utensils! Utter negligence.,Lidl
44,8am and store is quiet....the first thing you get is the smell of freshly baked bread. Yum.,Lidl
45,Big Lidl with good prices,Lidl
46,Nice place it's okay Like every Lidel I was the difference isn't I didn't see the Bike parking I don't know but it wasn't signedposted.,Lidl
47,Great new store. Great layout and very spacious. Doesn't have the full range that larger stores might have but still plenty of choice.,Lidl
48,Good place to shop clean and friendly staff always well stocked too,Lidl
49,Is good!,Lidl
50,"I had help packing my bags from the boys in blue, I felt slightly rushed.  They are a skeleton crew.  I love the food.",Lidl
51,"Car park small and now multi function,  ordinary cars, electric car area,  click and collect area, and disabled area, No problem with shop or produce.",Lidl
52,Ok -not fully stocked often enough and staff a little grumpy . Great for the area though thankful for it,Lidl
53,"Friendly staff. Manager really helpful and the shop really organise.
It’s my one stop groceries shopping place.
Staff also very helpful. I mean very helpful staff there.",Lidl
54,Fantastic Lidl. Loads of space and everything is well stocked. Lots of parking under the shop and staff are very nice and accommodating.,Lidl
55,"Got an alarm battery charger to go with the lights I purchased earlier  great stuff.
Lidl card is great  we'll worth using",Lidl
56,"I am Sad about the service to the costumers. The employers don't like to service us. Lidl needs to train everyone.
And I like to buy there. I don't know now what to do. Today was terrible",Lidl
57,"Way too few parking spots! There's only like 30 spaces which is ridiculous considering that there is no parking nearby at all. Wish I could go there, can't if there's no parking.",Lidl
58,"Cashier were very nice friendly,  but store was quiet empty @ the moments..",Lidl
59,"Clean and spacious store with the full range of products you'd expect from Lidl.

The fresh fruit and vegetables section has a good range.",Lidl
60,Great selection of food and goods great value and good service very pleasant staff,Lidl
61,Great shop well laid out. Disappointed only 2 tills open. Staff friendly.,Lidl
62,I found everything I wanted to buy and the cashier was extremely nice and very pleasant.  I have always found staff in Lidl to be very helpful.,Lidl
63,Lovely new store with limited parking,Lidl
64,Fairly well-stocked and conveniently open until late. Decent prices as well.,Lidl
65,"Nice supermarket but very packed at lunchtime. Lack of enough cashier desks, large queues to pay.",Lidl
66,"Big parking, but the shop is quite busy at the tills. I had problems finding everything needed.",Lidl
67,Great spot .... their App is simple & efficient. Very good selection of foodstuffs & their IPA is the business!,Lidl
68,"Nice place to shop,
Good selection cheap prices but parking a big problem",Lidl
69,Good offer and lots of things. EV charger so you can charge your car while shopping,Lidl
70,Good place to shop got some stuff that you can't get in other supermarkets.,Lidl
71,"Always a great shopping experience with friendly, helpful staff. Good prices & reasonable choices.",Lidl
72,Very convenient however it has too many large trolleys and no convenient smaller trolleys,Lidl
73,"Generally very well stocked, although till service can be slow.",Lidl
74,I have searched this whole place for an A4 sheet bundle and yet I couldn't find!,Lidl
75,"Great shop, easy access, feels safe in never seen it crowded",Lidl
76,Lovely shop. Handy carpark makes it accessible on way home from work,Lidl
77,Was in lidl in drumcondra today and no precautions are been taking...no hand sanitizer on way in and ppl standing to close to each other at till.,Lidl
78,"The best Lidl in Dublin to do shippings, very organized and good options.",Lidl
79,"Google is asking me to add a review of Lidl. Seriously? It's a supermarket, aimed at the budget-conscious buyer. Done.",Lidl
80,They have more variety than other Lids. They need more vegetarian options.,Lidl
81,"Lovely staff ,everything at you're finger tips ,good prices",Lidl
82,"Nice, big, new, friendly staff. No self-service cash desks :(",Lidl
83,Really good one ! Always stocked and well organized unlike the one in the city center.,Lidl
84,A really big store. Staff are friendly and the store is kept clean,Lidl
85,Lidl is different. Just different. And enjoyable. Excellent everything everywhere they are. And they appear to be everywhere. ' Comfort in that.,Lidl
86,Free parking but limited slots. With rich inventory of non-grocery stuff.,Lidl
87,Great. Has everything u need,Lidl
88,"Staff were great, they seem to know where everything is. Even across the store.",Lidl
89,"Excellent lidl that provides quality munch at a low price, would recommend to a friend.",Lidl
90,Good products at the best price.,Lidl
91,Good just had some saving from what I bought,Lidl
92,"Manager in drumcondra named Max in lidl is highly rude and clamps customers cars and pretends they left the premises, very disappointed",Lidl
93,Nice large discount supermarket in the centre of Drumcondra. Coffee only €1.,Lidl
94,"Good quality,  affordable price.",Lidl
95,Great place for grocery shopping. Variety of pasta are the best,Lidl
96,"Good parking, nice and clean inside",Lidl
97,"Great large lidl, quick parking underneath.",Lidl
98,Good 👍 always clean and friendly staff …,Lidl
99,A good place for shopping,Lidl
100,Crowded... Long queues,Lidl
101,Staff member at till not wèaring his  mask. This is Not Acceptable.,Lidl
102,New large Lidl.  Spacious and good selection at good prices.,Lidl
103,"Not too crowded, good prices",Lidl
104,A lot of products with a good price and quality,Lidl
105,I simply like the shop,Lidl
106,big Lidl! All good,Lidl
107,Got everything I needed and quickly,Lidl
108,Terrible. Need cashier. Organize products.,Lidl
109,"Great people, great shop and parking",Lidl
110,Shop is never stocked and queues sometimes unfavorable,Lidl
111,Clean and easy to get in and out quickly,Lidl
112,Quit big good selection and fair price,Lidl
113,"Only 2 lines open, queuing all the way down the shop.",Lidl
114,It's Big but need more stuff to sell,Lidl
115,Plenty of selection and staff very helpful,Lidl
116,Not inclined to give receipts,Lidl
117,Some products are always out of stock,Lidl
118,"Friendly staff
Helpful
Grrat value",Lidl
119,Good choice of fresh Irish products,Lidl
120,Plenty of room to shop in comfort,Lidl
121,Never enough checkouts open,Lidl
122,I think there a little messy. Not by the staff. It is by the arrangement of the goods,Lidl
123,Got a banging packet of buiscuits only 30c,Lidl
124,"More meat substitutes ASAP, Drumcondra is the India of North Dublin.",Lidl
125,"Long queues, lay out isn't great",Lidl
126,Still people not wearing masks and Lidl not enforcing it,Lidl
127,Girl on till lovely and very helpful,Lidl
128,Clean and well stocked.,Lidl
129,Very good and spotlessly clean,Lidl
130,Went early so empty and quiet,Lidl
131,Very good and clean place.,Lidl
132,Perfect. 😍❤️ …,Lidl
133,"Great shop, great prices",Lidl
134,Because not have staff what need,Lidl
135,Great staff and service,Lidl
136,Great addition to dublin 9,Lidl
137,Good Place to shop,Lidl
138,Very good 👍 👏 👌 😀. …,Lidl
139,You know what you get with Lidl,Lidl
140,At what time on Thursday are yous opening,Lidl
141,Pastel tru dip 😍 …,Lidl
142,Big and nice as usual,Lidl
143,just need to cheapen more,Lidl
144,Free coffee today!,Lidl
145,I was in lidi shopping yesterday,Lidl
146,Need a bit os,Lidl
147,Great,Lidl
148,Does what it says on the tin,Lidl
149,Excellent prices,Lidl
150,Super,Lidl
151,Good,Lidl
152,The best supermarket,Lidl
153,It is what lidl is,Lidl
154,I often go here for lunch because I can buy bread cheaply.,Lidl
155,"I really don't like shopping here, it's big and everything is even a little bigger than some Lidl but having 7 cash registers they only use 1 or 2, rarely 3 and very common that you have to stand in a line sometimes very long, as they don't take away the boxes and they put some self-collection",Lidl
156,"It is often dirty, especially on Sunday, the service is gloomy and rude with a few exceptions.... The price on the shelves often does not match the bill",Lidl
157,A very stocked store! I recommend!,Lidl
158,Ok whether,Lidl
159,Parking is a real problem,Lidl
160,V nice staff,Lidl
161,EXCELLENT,Lidl
162,😁close to my home …,Lidl
163,Good,Lidl
164,Good,Lidl
165,OK,Lidl
166,Great!!!,Lidl
1,"Have a bad back and young chap Michael was more than happy to give me assistance. Can’t thank this lad enough. Keep him. Such a gentleman. Not many genuine staff about anymore, but Michael had really made my day",Lidl
2,Could you kindly consider converting one of these to self-checkout tills if there won't be any staff available to assist?,Lidl
3,"I went to this store over the weekend and I have to say, customer service is absolutely amazing. Had an amazing lad called Michael assist me the best he could. So polite and friendly. Although he had overwhelming customers, he kept a smile on his face and continued to do his work. It’s an amazing gift to have, being able to do your job whilst under pressure. I’d recommend this and I hope Michael gets the recognition he deserves.",Lidl
4,Was shopping hear at the weekend a wonderful young lad cian helped me with my shopping he also told me his recipe for coddle and helped me pick out all the ingredients can not wait to try it highly recommend Lidl,Lidl
5,"Lovely place for family and friends ❤️
Lots of items for Christmas 🎄🎄 happy to be back …",Lidl
6,"Ridiculous customer service. I wish I could give less than one star.  Today I went there and I got some groceries. After paying I noticed that one of the product  was not sealed and the box was opened. The lady who was working on the till told me to exchange which I tried but  I could not find the same product  and I got a similar one and I told her that I would pay the difference. Then she asked me to queue up again and I did for quite long and when I got there to exchange the product she told that wouldn't be possible.
So incompetent and rude 😒",Lidl
7,I was in the Santry Lidl store recently and I was there for the very first time purchasing my lotto tickets for the weekend and when I handed one of the store assistants the lottery tickets that I purchased he hadn't any idea how to put the tickets through the machine that I purchased as the lottery machines in Lidl are different to the ones that any  newsagents and other supermarkets would have and he had to call over one of his work colleagues to show him how to scan the lottery tickets that I purchased on the machine and I also handed him two tickets that I won 2 free Daily millions Quick Picks on from a previous lotto draw that I did the lotto for and when he did scan one of the tickets that had one of the Daily millions Quick Picks on only one of them printed out for him and the other one didn't print out of the machine for him and then he had to call a work colleague over to his till to serve me as he hadn't an idea how the lottery machines worked and his work colleague wasn't very helpful with dealing with my situation as I demanded that I got my prizes that I won from a previous lotto draw that I did my lotto for and then the situation got to a point that the other store assistant that served me spoke to the security guard who was on duty at the time I purchased my lottery tickets for the weekend and collecting my 2 free Daily millions Quick Picks by denying that I hadn't won anything on the 2 printed tickets that I handed to her to check for me and she kept on saying that I didn't win 2 free Daily millions Quick Picks and then the security guard asked me to leave the store when I demanded that I got my prizes that I won from the lottery and then eventually after waiting more than half an hour to be served I finally got served properly by a different store assistant who believed that I was telling the truth about me winning the 2 free Daily millions Quick Picks and she had to go back and forth to a checkout that I won the 2 free Daily millions Quick Picks on and she had to print out 2 of the tickets for me as the ones that had the prizes on said invalid ticket and throughout the half hour or so I was in the supermarket for I was very agitated and frustrated while I was waiting to be served properly by a store assistant as I wasn't too pleased with the store assistants and my customer service in the Santry Lidl except for the one who believed that I was telling the truth about winning the 2 free Daily millions Quick Picks and I would like for this store to get better staff who knows how to log into the lottery machines in Lidl in Santry and any other lidl stores around the country that sells the national lottery as the staff in Santry Lidl aren't great at serving the customers the lottery and they need to stop denying that the machines aren't working when they do be working and it's not fair that I had to wait half an hour or more to be served the lottery by a store assistant or anyone wishing to purchase the lottery as people should be served in a fair and polite manner rather than being sweared at over an issue which isn't their fault at all and having to wait half an hour or a long period of time to be served the lottery that want to purchase the lottery,Lidl
